{
  "format": "composer-kit-workflow",
  "version": 1,
  "kitId": "analytics-kit",
  "kitVersion": "c4b2b7b-ui.1",
  "status": "draft",
  "scope": "描述趨勢、上傳歷史查詢與匯出。三個端點各自查詢資料；匯出不呼叫歷史清單端點，不建立強制先後連線。未涵蓋無已驗證獨立能力的資料摘要。沿用 registry 已揭露的限制：上傳歷史 status 篩選仍用舊狀態，但資料源為 ImportJob，可能查無結果。尚未完成執行驗證。",
  "nodes": [
    { "id": "trend", "name": "查詢資料趨勢", "subfeatureId": "trend-analysis", "capabilityIds": ["analytics.trend"] },
    { "id": "upload-history", "name": "查詢上傳歷史", "subfeatureId": "upload-history", "capabilityIds": ["analytics.upload-history.list"] },
    { "id": "export-history", "name": "匯出上傳歷史", "subfeatureId": "upload-history", "capabilityIds": ["analytics.upload-history.export"] }
  ],
  "edges": []
}
